"Hub-Fortify-Integration-Test1",1.0,"8d072802-0788-4e8b-8d07-c8575fdf1ffd","beaf6079-7d71-4603-a80a-dac4be91e5e3",,"Apache Tomcat",5.5.7,maven,"tomcat:jasper-compiler:5.5.7",5.5.7,CVE-2012-5887,"The HTTP Digest Access Authentication implementation in Apache Tomcat 5.5.x before 5.5.36, 6.x before 6.0.36, and 7.x before 7.0.30 does not properly check for stale nonce values in conjunction with enforcement of proper credentials, which makes it easier for remote attackers to bypass intended access restrictions by sniffing the network for valid requests.",2012-11-19,2013-08-20,5.0,10.0,2.9,NVD,,NEW,,,,"http://web.nvd.nist.gov/view/vuln/detail?vulnId=CVE-2012-5887",MEDIUM,"2017-05-26 01:30:59.716"
"Hub-Fortify-Integration-Test1",1.0,"8d072802-0788-4e8b-8d07-c8575fdf1ffd","beaf6079-7d71-4603-a80a-dac4be91e5e3",,"Apache Tomcat",5.5.7,maven,"tomcat:jasper-compiler:5.5.7",5.5.7,CVE-2013-2185,"** DISPUTED ** The readObject method in the DiskFileItem class in Apache Tomcat and JBoss Web, as used in Red Hat JBoss Enterprise Application Platform 6.1.0 and Red Hat JBoss Portal 6.0.0, allows remote attackers to write to arbitrary files via a NULL byte in a file name in a serialized instance, a similar issue to CVE-2013-2186.  NOTE: this issue is reportedly disputed by the Apache Tomcat team, although Red Hat considers it a vulnerability. The dispute appears to regard whether it is the responsibility of applications to avoid providing untrusted data to be deserialized, or whether this class should inherently protect against this issue.",2016-11-01,2016-11-01,7.5,10.0,6.4,NVD,,NEW,,,,"http://web.nvd.nist.gov/view/vuln/detail?vulnId=CVE-2013-2185",HIGH,"2017-05-26 01:30:59.716"
"Hub-Fortify-Integration-Test1",1.0,"8d072802-0788-4e8b-8d07-c8575fdf1ffd","beaf6079-7d71-4603-a80a-dac4be91e5e3",,"Apache Tomcat",5.5.7,maven,"tomcat:jasper-compiler:5.5.7",5.5.7,CVE-2013-4286,"Apache Tomcat before 6.0.39, 7.x before 7.0.47, and 8.x before 8.0.0-RC3, when an HTTP connector or AJP connector is used, does not properly handle certain inconsistent HTTP request headers, which allows remote attackers to trigger incorrect identification of a request's length and conduct request-smuggling attacks via (1) multiple Content-Length headers or (2) a Content-Length header and a ""Transfer-Encoding: chunked"" header.  NOTE: this vulnerability exists because of an incomplete fix for CVE-2005-2090.",2014-02-26,2016-12-08,5.8,8.6,4.9,NVD,,NEW,,,,"http://web.nvd.nist.gov/view/vuln/detail?vulnId=CVE-2013-4286",MEDIUM,"2017-05-26 01:30:59.716"
"Hub-Fortify-Integration-Test1",1.0,"8d072802-0788-4e8b-8d07-c8575fdf1ffd","beaf6079-7d71-4603-a80a-dac4be91e5e3",,"Apache Tomcat",5.5.7,maven,"tomcat:jasper-compiler:5.5.7",5.5.7,CVE-2013-4322,"Apache Tomcat before 6.0.39, 7.x before 7.0.50, and 8.x before 8.0.0-RC10 processes chunked transfer coding without properly handling (1) a large total amount of chunked data or (2) whitespace characters in an HTTP header value within a trailer field, which allows remote attackers to cause a denial of service by streaming data.  NOTE: this vulnerability exists because of an incomplete fix for CVE-2012-3544.",2016-06-24,2017-01-07,4.3,8.6,2.9,NVD,,NEW,,,,"http://web.nvd.nist.gov/view/vuln/detail?vulnId=CVE-2013-4322",MEDIUM,"2017-05-26 01:30:59.716"
"Hub-Fortify-Integration-Test1",1.0,"8d072802-0788-4e8b-8d07-c8575fdf1ffd","beaf6079-7d71-4603-a80a-dac4be91e5e3",,"Apache Tomcat",5.5.7,maven,"tomcat:jasper-compiler:5.5.7",5.5.7,CVE-2013-4444,"Unrestricted file upload vulnerability in Apache Tomcat 7.x before 7.0.40, in certain situations involving outdated java.io.File code and a custom JMX configuration, allows remote attackers to execute arbitrary code by uploading and accessing a JSP file.",2014-09-12,2017-01-07,6.8,8.6,6.4,NVD,,NEW,,,,"http://web.nvd.nist.gov/view/vuln/detail?vulnId=CVE-2013-4444",MEDIUM,"2017-05-26 01:30:59.716"
"Hub-Fortify-Integration-Test1",1.0,"8d072802-0788-4e8b-8d07-c8575fdf1ffd","beaf6079-7d71-4603-a80a-dac4be91e5e3",,"Apache Tomcat",5.5.7,maven,"tomcat:jasper-compiler:5.5.7",5.5.7,CVE-2013-4590,"Apache Tomcat before 6.0.39, 7.x before 7.0.50, and 8.x before 8.0.0-RC10 allows attackers to obtain ""Tomcat internals"" information by leveraging the presence of an untrusted web application with a context.xml, web.xml, *.jspx, *.tagx, or *.tld XML document containing an external entity declaration in conjunction with an entity reference, related to an XML External Entity (XXE) issue.",2016-11-18,2017-01-07,4.3,8.6,2.9,NVD,,NEW,,,,"http://web.nvd.nist.gov/view/vuln/detail?vulnId=CVE-2013-4590",MEDIUM,"2017-05-26 01:30:59.716"
"Hub-Fortify-Integration-Test1",1.0,"8d072802-0788-4e8b-8d07-c8575fdf1ffd","beaf6079-7d71-4603-a80a-dac4be91e5e3",,"Apache Tomcat",5.5.7,maven,"tomcat:jasper-compiler:5.5.7",5.5.7,CVE-2013-6357,"** DISPUTED ** Cross-site request forgery (CSRF) vulnerability in the Manager application in Apache Tomcat 5.5.25 and earlier allows remote attackers to hijack the authentication of administrators for requests that manipulate application deployment via the POST method, as demonstrated by a /manager/html/undeploy?path= URI.  NOTE: the vendor disputes the significance of this report, stating that ""the Apache Tomcat Security team has not accepted any reports of CSRF attacks against the Manager application ... as they require a reckless system administrator.""",2013-11-14,2013-11-14,6.8,8.6,6.4,NVD,,NEW,,,,"http://web.nvd.nist.gov/view/vuln/detail?vulnId=CVE-2013-6357",MEDIUM,"2017-05-26 01:30:59.716"
"Hub-Fortify-Integration-Test1",1.0,"8d072802-0788-4e8b-8d07-c8575fdf1ffd","beaf6079-7d71-4603-a80a-dac4be91e5e3",,"Apache Tomcat",5.5.7,maven,"tomcat:jasper-compiler:5.5.7",5.5.7,CVE-2014-0075,"Integer overflow in the parseChunkHeader function in java/org/apache/coyote/http11/filters/ChunkedInputFilter.java in Apache Tomcat before 6.0.40, 7.x before 7.0.53, and 8.x before 8.0.4 allows remote attackers to cause a denial of service (resource consumption) via a malformed chunk size in chunked transfer coding of a request during the streaming of data.",2016-06-28,2017-01-07,5.0,10.0,2.9,NVD,,NEW,,,,"http://web.nvd.nist.gov/view/vuln/detail?vulnId=CVE-2014-0075",MEDIUM,"2017-05-26 01:30:59.716"
"Hub-Fortify-Integration-Test1",1.0,"8d072802-0788-4e8b-8d07-c8575fdf1ffd","beaf6079-7d71-4603-a80a-dac4be91e5e3",,"Apache Tomcat",5.5.7,maven,"tomcat:jasper-compiler:5.5.7",5.5.7,CVE-2014-0096,"java/org/apache/catalina/servlets/DefaultServlet.java in the default servlet in Apache Tomcat before 6.0.40, 7.x before 7.0.53, and 8.x before 8.0.4 does not properly restrict XSLT stylesheets, which allows remote attackers to bypass security-manager restrictions and read arbitrary files via a crafted web application that provides an XML external entity declaration in conjunction with an entity reference, related to an XML External Entity (XXE) issue.",2016-06-28,2017-01-07,4.3,8.6,2.9,NVD,,NEW,,,,"http://web.nvd.nist.gov/view/vuln/detail?vulnId=CVE-2014-0096",MEDIUM,"2017-05-26 01:30:59.716"
"Hub-Fortify-Integration-Test1",1.0,"8d072802-0788-4e8b-8d07-c8575fdf1ffd","beaf6079-7d71-4603-a80a-dac4be91e5e3",,"Apache Tomcat",5.5.7,maven,"tomcat:jasper-compiler:5.5.7",5.5.7,CVE-2014-0099,"Integer overflow in java/org/apache/tomcat/util/buf/Ascii.java in Apache Tomcat before 6.0.40, 7.x before 7.0.53, and 8.x before 8.0.4, when operated behind a reverse proxy, allows remote attackers to conduct HTTP request smuggling attacks via a crafted Content-Length HTTP header.",2016-06-28,2017-01-07,4.3,8.6,2.9,NVD,,NEW,,,,"http://web.nvd.nist.gov/view/vuln/detail?vulnId=CVE-2014-0099",MEDIUM,"2017-05-26 01:30:59.716"
"Hub-Fortify-Integration-Test1",1.0,"8d072802-0788-4e8b-8d07-c8575fdf1ffd","beaf6079-7d71-4603-a80a-dac4be91e5e3",,"Apache Tomcat",5.5.7,maven,"tomcat:jasper-compiler:5.5.7",5.5.7,CVE-2014-0119,"Apache Tomcat before 6.0.40, 7.x before 7.0.54, and 8.x before 8.0.6 does not properly constrain the class loader that accesses the XML parser used with an XSLT stylesheet, which allows remote attackers to (1) read arbitrary files via a crafted web application that provides an XML external entity declaration in conjunction with an entity reference, related to an XML External Entity (XXE) issue, or (2) read files associated with different web applications on a single Tomcat instance via a crafted web application.",2016-06-24,2017-01-07,4.3,8.6,2.9,NVD,,NEW,,,,"http://web.nvd.nist.gov/view/vuln/detail?vulnId=CVE-2014-0119",MEDIUM,"2017-05-26 01:30:59.716"
"Hub-Fortify-Integration-Test1",1.0,"8d072802-0788-4e8b-8d07-c8575fdf1ffd","beaf6079-7d71-4603-a80a-dac4be91e5e3",,"Apache Tomcat",5.5.7,maven,"tomcat:jasper-compiler:5.5.7",5.5.7,CVE-2015-0254,"Apache Standard Taglibs before 1.2.3 allows remote attackers to execute arbitrary code or conduct external XML entity (XXE) attacks via a crafted XSLT extension in a (1) <x:parse> or (2) <x:transform> JSTL XML tag.",2016-08-29,2016-12-22,7.5,10.0,6.4,NVD,,NEW,,,,"http://web.nvd.nist.gov/view/vuln/detail?vulnId=CVE-2015-0254",HIGH,"2017-05-26 01:30:59.716"
"Hub-Fortify-Integration-Test1",1.0,"8d072802-0788-4e8b-8d07-c8575fdf1ffd","beaf6079-7d71-4603-a80a-dac4be91e5e3",,"Apache Tomcat",5.5.7,maven,"tomcat:jasper-compiler:5.5.7",5.5.7,CVE-2016-5388,"Apache Tomcat through 8.5.4, when the CGI Servlet is enabled, follows RFC 3875 section 4.1.18 and therefore does not protect applications from the presence of untrusted client data in the HTTP_PROXY environment variable, which might allow remote attackers to redirect an application's outbound HTTP traffic to an arbitrary proxy server via a crafted Proxy header in an HTTP request, aka an ""httpoxy"" issue. NOTE: the vendor states ""A mitigation is planned for future releases of Tomcat, tracked as CVE-2016-5388""; in other words, this is not a CVE ID for a vulnerability.",2016-11-02,2017-02-17,5.1,4.9,6.4,NVD,,NEW,,,,"http://web.nvd.nist.gov/view/vuln/detail?vulnId=CVE-2016-5388",MEDIUM,"2017-05-26 01:30:59.716"
"Hub-Fortify-Integration-Test1",1.0,"8d072802-0788-4e8b-8d07-c8575fdf1ffd","ccdf1a41-a292-4fdd-a12c-093fcb8acda4",,"Apache Tomcat",1.0.8.5,unknown,null,1.0.8.5,CVE-2007-0450,"Directory traversal vulnerability in Apache HTTP Server and Tomcat 5.x before 5.5.22 and 6.x before 6.0.10, when using certain proxy modules (mod_proxy, mod_rewrite, mod_jk), allows remote attackers to read arbitrary files via a .. (dot dot) sequence with combinations of (1) ""/"" (slash), (2) ""\"" (backslash), and (3) URL-encoded backslash (%5C) characters in the URL, which are valid separators in Tomcat but not in Apache.",2007-03-19,2011-03-08,5.0,10.0,2.9,NVD,,NEW,,,,"http://web.nvd.nist.gov/view/vuln/detail?vulnId=CVE-2007-0450",MEDIUM,"2017-05-26 01:30:59.716"
"Hub-Fortify-Integration-Test1",1.0,"8d072802-0788-4e8b-8d07-c8575fdf1ffd","ccdf1a41-a292-4fdd-a12c-093fcb8acda4",,"Apache Tomcat",1.0.8.5,unknown,null,1.0.8.5,CVE-2012-5568,"Apache Tomcat through 7.0.x allows remote attackers to cause a denial of service (daemon outage) via partial HTTP requests, as demonstrated by Slowloris.",2012-12-03,2013-03-07,5.0,10.0,2.9,NVD,,NEW,,,,"http://web.nvd.nist.gov/view/vuln/detail?vulnId=CVE-2012-5568",MEDIUM,"2017-05-26 01:30:59.716"
"Hub-Fortify-Integration-Test1",1.0,"8d072802-0788-4e8b-8d07-c8575fdf1ffd","ccdf1a41-a292-4fdd-a12c-093fcb8acda4",,"Apache Tomcat",1.0.8.5,unknown,null,1.0.8.5,CVE-2013-2185,"** DISPUTED ** The readObject method in the DiskFileItem class in Apache Tomcat and JBoss Web, as used in Red Hat JBoss Enterprise Application Platform 6.1.0 and Red Hat JBoss Portal 6.0.0, allows remote attackers to write to arbitrary files via a NULL byte in a file name in a serialized instance, a similar issue to CVE-2013-2186.  NOTE: this issue is reportedly disputed by the Apache Tomcat team, although Red Hat considers it a vulnerability. The dispute appears to regard whether it is the responsibility of applications to avoid providing untrusted data to be deserialized, or whether this class should inherently protect against this issue.",2016-11-01,2016-11-01,7.5,10.0,6.4,NVD,,NEW,,,,"http://web.nvd.nist.gov/view/vuln/detail?vulnId=CVE-2013-2185",HIGH,"2017-05-26 01:30:59.716"
"Hub-Fortify-Integration-Test1",1.0,"8d072802-0788-4e8b-8d07-c8575fdf1ffd","ccdf1a41-a292-4fdd-a12c-093fcb8acda4",,"Apache Tomcat",1.0.8.5,unknown,null,1.0.8.5,CVE-2013-4286,"Apache Tomcat before 6.0.39, 7.x before 7.0.47, and 8.x before 8.0.0-RC3, when an HTTP connector or AJP connector is used, does not properly handle certain inconsistent HTTP request headers, which allows remote attackers to trigger incorrect identification of a request's length and conduct request-smuggling attacks via (1) multiple Content-Length headers or (2) a Content-Length header and a ""Transfer-Encoding: chunked"" header.  NOTE: this vulnerability exists because of an incomplete fix for CVE-2005-2090.",2014-02-26,2016-12-08,5.8,8.6,4.9,NVD,,NEW,,,,"http://web.nvd.nist.gov/view/vuln/detail?vulnId=CVE-2013-4286",MEDIUM,"2017-05-26 01:30:59.716"
"Hub-Fortify-Integration-Test1",1.0,"8d072802-0788-4e8b-8d07-c8575fdf1ffd","ccdf1a41-a292-4fdd-a12c-093fcb8acda4",,"Apache Tomcat",1.0.8.5,unknown,null,1.0.8.5,CVE-2013-4322,"Apache Tomcat before 6.0.39, 7.x before 7.0.50, and 8.x before 8.0.0-RC10 processes chunked transfer coding without properly handling (1) a large total amount of chunked data or (2) whitespace characters in an HTTP header value within a trailer field, which allows remote attackers to cause a denial of service by streaming data.  NOTE: this vulnerability exists because of an incomplete fix for CVE-2012-3544.",2016-06-24,2017-01-07,4.3,8.6,2.9,NVD,,NEW,,,,"http://web.nvd.nist.gov/view/vuln/detail?vulnId=CVE-2013-4322",MEDIUM,"2017-05-26 01:30:59.716"
"Hub-Fortify-Integration-Test1",1.0,"8d072802-0788-4e8b-8d07-c8575fdf1ffd","ccdf1a41-a292-4fdd-a12c-093fcb8acda4",,"Apache Tomcat",1.0.8.5,unknown,null,1.0.8.5,CVE-2013-4444,"Unrestricted file upload vulnerability in Apache Tomcat 7.x before 7.0.40, in certain situations involving outdated java.io.File code and a custom JMX configuration, allows remote attackers to execute arbitrary code by uploading and accessing a JSP file.",2014-09-12,2017-01-07,6.8,8.6,6.4,NVD,,NEW,,,,"http://web.nvd.nist.gov/view/vuln/detail?vulnId=CVE-2013-4444",MEDIUM,"2017-05-26 01:30:59.716"
"Hub-Fortify-Integration-Test1",1.0,"8d072802-0788-4e8b-8d07-c8575fdf1ffd","ccdf1a41-a292-4fdd-a12c-093fcb8acda4",,"Apache Tomcat",1.0.8.5,unknown,null,1.0.8.5,CVE-2013-4590,"Apache Tomcat before 6.0.39, 7.x before 7.0.50, and 8.x before 8.0.0-RC10 allows attackers to obtain ""Tomcat internals"" information by leveraging the presence of an untrusted web application with a context.xml, web.xml, *.jspx, *.tagx, or *.tld XML document containing an external entity declaration in conjunction with an entity reference, related to an XML External Entity (XXE) issue.",2016-11-18,2017-01-07,4.3,8.6,2.9,NVD,,NEW,,,,"http://web.nvd.nist.gov/view/vuln/detail?vulnId=CVE-2013-4590",MEDIUM,"2017-05-26 01:30:59.716"
"Hub-Fortify-Integration-Test1",1.0,"8d072802-0788-4e8b-8d07-c8575fdf1ffd","ccdf1a41-a292-4fdd-a12c-093fcb8acda4",,"Apache Tomcat",1.0.8.5,unknown,null,1.0.8.5,CVE-2014-0075,"Integer overflow in the parseChunkHeader function in java/org/apache/coyote/http11/filters/ChunkedInputFilter.java in Apache Tomcat before 6.0.40, 7.x before 7.0.53, and 8.x before 8.0.4 allows remote attackers to cause a denial of service (resource consumption) via a malformed chunk size in chunked transfer coding of a request during the streaming of data.",2016-06-28,2017-01-07,5.0,10.0,2.9,NVD,,NEW,,,,"http://web.nvd.nist.gov/view/vuln/detail?vulnId=CVE-2014-0075",MEDIUM,"2017-05-26 01:30:59.716"
"Hub-Fortify-Integration-Test1",1.0,"8d072802-0788-4e8b-8d07-c8575fdf1ffd","ccdf1a41-a292-4fdd-a12c-093fcb8acda4",,"Apache Tomcat",1.0.8.5,unknown,null,1.0.8.5,CVE-2014-0096,"java/org/apache/catalina/servlets/DefaultServlet.java in the default servlet in Apache Tomcat before 6.0.40, 7.x before 7.0.53, and 8.x before 8.0.4 does not properly restrict XSLT stylesheets, which allows remote attackers to bypass security-manager restrictions and read arbitrary files via a crafted web application that provides an XML external entity declaration in conjunction with an entity reference, related to an XML External Entity (XXE) issue.",2016-06-28,2017-01-07,4.3,8.6,2.9,NVD,,NEW,,,,"http://web.nvd.nist.gov/view/vuln/detail?vulnId=CVE-2014-0096",MEDIUM,"2017-05-26 01:30:59.716"
"Hub-Fortify-Integration-Test1",1.0,"8d072802-0788-4e8b-8d07-c8575fdf1ffd","ccdf1a41-a292-4fdd-a12c-093fcb8acda4",,"Apache Tomcat",1.0.8.5,unknown,null,1.0.8.5,CVE-2014-0099,"Integer overflow in java/org/apache/tomcat/util/buf/Ascii.java in Apache Tomcat before 6.0.40, 7.x before 7.0.53, and 8.x before 8.0.4, when operated behind a reverse proxy, allows remote attackers to conduct HTTP request smuggling attacks via a crafted Content-Length HTTP header.",2016-06-28,2017-01-07,4.3,8.6,2.9,NVD,,NEW,,,,"http://web.nvd.nist.gov/view/vuln/detail?vulnId=CVE-2014-0099",MEDIUM,"2017-05-26 01:30:59.716"
"Hub-Fortify-Integration-Test1",1.0,"8d072802-0788-4e8b-8d07-c8575fdf1ffd","ccdf1a41-a292-4fdd-a12c-093fcb8acda4",,"Apache Tomcat",1.0.8.5,unknown,null,1.0.8.5,CVE-2014-0119,"Apache Tomcat before 6.0.40, 7.x before 7.0.54, and 8.x before 8.0.6 does not properly constrain the class loader that accesses the XML parser used with an XSLT stylesheet, which allows remote attackers to (1) read arbitrary files via a crafted web application that provides an XML external entity declaration in conjunction with an entity reference, related to an XML External Entity (XXE) issue, or (2) read files associated with different web applications on a single Tomcat instance via a crafted web application.",2016-06-24,2017-01-07,4.3,8.6,2.9,NVD,,NEW,,,,"http://web.nvd.nist.gov/view/vuln/detail?vulnId=CVE-2014-0119",MEDIUM,"2017-05-26 01:30:59.716"
"Hub-Fortify-Integration-Test1",1.0,"8d072802-0788-4e8b-8d07-c8575fdf1ffd","ccdf1a41-a292-4fdd-a12c-093fcb8acda4",,"Apache Tomcat",1.0.8.5,unknown,null,1.0.8.5,CVE-2016-5388,"Apache Tomcat through 8.5.4, when the CGI Servlet is enabled, follows RFC 3875 section 4.1.18 and therefore does not protect applications from the presence of untrusted client data in the HTTP_PROXY environment variable, which might allow remote attackers to redirect an application's outbound HTTP traffic to an arbitrary proxy server via a crafted Proxy header in an HTTP request, aka an ""httpoxy"" issue. NOTE: the vendor states ""A mitigation is planned for future releases of Tomcat, tracked as CVE-2016-5388""; in other words, this is not a CVE ID for a vulnerability.",2016-11-02,2017-02-17,5.1,4.9,6.4,NVD,,NEW,,,,"http://web.nvd.nist.gov/view/vuln/detail?vulnId=CVE-2016-5388",MEDIUM,"2017-05-26 01:30:59.716"
"Hub-Fortify-Integration-Test1",1.0,"8d072802-0788-4e8b-8d07-c8575fdf1ffd","d6d4041b-acfe-46a3-9c37-8eaa93630e1f",,"Apache Tomcat",8.5.0,unknown,null,8.5.0,146348,"Apache Tomcat contains a flaw in the SecurityManager, as access to system properties is not properly restricted for the configuration files system property replacement feature. This may allow a malicious web application to bypass SecurityManager restrictions and disclose system properties.",2016-10-27,2017-05-15,1.2,1.9,2.9,VULNDB,,NEW,,,,,LOW,"2017-05-26 01:30:59.716"
"Hub-Fortify-Integration-Test1",1.0,"8d072802-0788-4e8b-8d07-c8575fdf1ffd","d6d4041b-acfe-46a3-9c37-8eaa93630e1f",,"Apache Tomcat",8.5.0,unknown,null,8.5.0,146354,"Apache Tomcat contains an unspecified flaw related to web applications that may allow a local attacker to bypass a configured SecurityManager via a utility method that is accessible to web applications. No further details have been provided.",2016-10-27,2017-05-15,1.2,1.9,2.9,VULNDB,,NEW,,,,,LOW,"2017-05-26 01:30:59.716"
"Hub-Fortify-Integration-Test1",1.0,"8d072802-0788-4e8b-8d07-c8575fdf1ffd","d6d4041b-acfe-46a3-9c37-8eaa93630e1f",,"Apache Tomcat",8.5.0,unknown,null,8.5.0,146355,"Apache Tomcat contains a flaw in realm that is triggered as passwords are not processed when paired with a non-existent username. This may allow a remote attacker to enumerate user account names via a timing attack.",2016-10-27,2017-05-15,4.3,8.6,2.9,VULNDB,,NEW,,,,,MEDIUM,"2017-05-26 01:30:59.716"
"Hub-Fortify-Integration-Test1",1.0,"8d072802-0788-4e8b-8d07-c8575fdf1ffd","d6d4041b-acfe-46a3-9c37-8eaa93630e1f",,"Apache Tomcat",8.5.0,unknown,null,8.5.0,146356,"Apache Tomcat contains a flaw that may allow a local attacker to use a specially crafted web application to bypass a configured SecurityManager by changing the configuration parameters for the JSP Servlet.",2016-10-27,2017-05-15,1.2,1.9,2.9,VULNDB,,NEW,,,,,LOW,"2017-05-26 01:30:59.716"
"Hub-Fortify-Integration-Test1",1.0,"8d072802-0788-4e8b-8d07-c8575fdf1ffd","d6d4041b-acfe-46a3-9c37-8eaa93630e1f",,"Apache Tomcat",8.5.0,unknown,null,8.5.0,146357,"Apache Tomcat contains a flaw that is triggered as the program fails to limit web application access to global JNDI resources. This may allow a local attacker to gain unauthorized access to resources.",2016-10-27,2017-05-15,1.2,1.9,2.9,VULNDB,,NEW,,,,,LOW,"2017-05-26 01:30:59.716"
"Hub-Fortify-Integration-Test1",1.0,"8d072802-0788-4e8b-8d07-c8575fdf1ffd","d6d4041b-acfe-46a3-9c37-8eaa93630e1f",,"Apache Tomcat",8.5.0,unknown,null,8.5.0,147617,"Apache Tomcat contains a flaw in catalina/mbeans/JmxRemoteLifecycleListener.java that is triggered during the deserialization of Java objects. This may allow a remote attacker to potentially execute arbitrary code.",2016-11-22,2017-05-10,7.5,10.0,6.4,VULNDB,,DUPLICATE,,,,,HIGH,"2017-05-26 01:30:59.716"
"Hub-Fortify-Integration-Test1",1.0,"8d072802-0788-4e8b-8d07-c8575fdf1ffd","d6d4041b-acfe-46a3-9c37-8eaa93630e1f",,"Apache Tomcat",8.5.0,unknown,null,8.5.0,147618,"Apache Tomcat contains an infinite loop condition in the HTTP/2 parser that is triggered when handling overly large headers. With a specially crafted request, a remote attacker can cause a denial of service.",2016-11-22,2017-05-10,5.0,10.0,2.9,VULNDB,,NEW,,,,,MEDIUM,"2017-05-26 01:30:59.716"
"Hub-Fortify-Integration-Test1",1.0,"8d072802-0788-4e8b-8d07-c8575fdf1ffd","d6d4041b-acfe-46a3-9c37-8eaa93630e1f",,"Apache Tomcat",8.5.0,unknown,null,8.5.0,147619,"Apache Tomcat contains a flaw that is triggered when handling request lines containing certain invalid characters. This allows a remote attacker to inject additional headers into responses to conduct HTTP response splitting attacks.",2016-11-22,2017-05-24,6.8,8.6,6.4,VULNDB,,DUPLICATE,,,,,MEDIUM,"2017-05-26 01:30:59.716"
"Hub-Fortify-Integration-Test1",1.0,"8d072802-0788-4e8b-8d07-c8575fdf1ffd","d6d4041b-acfe-46a3-9c37-8eaa93630e1f",,"Apache Tomcat",8.5.0,unknown,null,8.5.0,148477,"Apache Tomcat contains a flaw in the NIO HTTP connector. The issue is triggered when handling send file errors, as a Processor object may be shared among concurrent requests. This may allow a remote attacker to potentially disclose sensitive information like session IDs or response body related to another request.",2016-12-12,2017-05-16,4.3,8.6,2.9,VULNDB,,NEW,,,,,MEDIUM,"2017-05-26 01:30:59.716"
"Hub-Fortify-Integration-Test1",1.0,"8d072802-0788-4e8b-8d07-c8575fdf1ffd","d6d4041b-acfe-46a3-9c37-8eaa93630e1f",,"Apache Tomcat",8.5.0,unknown,null,8.5.0,155233,"Apache Tomcat contains a flaw in the handling of object references that is triggered when calling certain application listeners. With a specially crafted web application, a local attacker may gain access to information associated with another web application.",2017-04-11,2017-05-16,6.4,10.0,4.9,VULNDB,,DUPLICATE,,,,,MEDIUM,"2017-05-26 01:30:59.716"
"Hub-Fortify-Integration-Test1",1.0,"8d072802-0788-4e8b-8d07-c8575fdf1ffd","d6d4041b-acfe-46a3-9c37-8eaa93630e1f",,"Apache Tomcat",8.5.0,unknown,null,8.5.0,155234,"Apache Tomcat contains an unspecified flaw in the pipelined request handling that is triggered when send file processing was used. This may result in responses being sent for different requests and may allow a remote attacker to disclose potentially sensitive information.",2017-04-11,2017-05-16,5.0,10.0,2.9,VULNDB,,DUPLICATE,,,,,MEDIUM,"2017-05-26 01:30:59.716"
"Hub-Fortify-Integration-Test1",1.0,"8d072802-0788-4e8b-8d07-c8575fdf1ffd","d6d4041b-acfe-46a3-9c37-8eaa93630e1f",,"Apache Tomcat",8.5.0,unknown,null,8.5.0,155235,"Apache Tomcat contains a flaw in the handling of HTTP/2 GOAWAY Frames that is triggered as streams associated with the connections are not properly closed. With specially crafted HTTP/2 requests, a remote attacker can exhaust available threads, resulting in a denial of service.",2017-04-11,2017-05-08,5.0,10.0,2.9,VULNDB,,DUPLICATE,,,,,MEDIUM,"2017-05-26 01:30:59.716"
"Hub-Fortify-Integration-Test1",1.0,"8d072802-0788-4e8b-8d07-c8575fdf1ffd","d6d4041b-acfe-46a3-9c37-8eaa93630e1f",,"Apache Tomcat",8.5.0,unknown,null,8.5.0,155460,"Apache Tomcat contains a flaw in the refactoring of HTTP connectors related to the processing of send files. This may cause the processor to be added to the processor cache twice, allowing a remote attacker to gain access to sensitive information from other sessions which use the processor for requests.",2017-04-12,2017-05-08,7.5,10.0,6.4,VULNDB,,DUPLICATE,,,,,HIGH,"2017-05-26 01:30:59.716"
"Hub-Fortify-Integration-Test1",1.0,"8d072802-0788-4e8b-8d07-c8575fdf1ffd","d6d4041b-acfe-46a3-9c37-8eaa93630e1f",,"Apache Tomcat",8.5.0,unknown,null,8.5.0,CVE-2016-3092,"The MultipartStream class in Apache Commons Fileupload before 1.3.2, as used in Apache Tomcat 7.x before 7.0.70, 8.x before 8.0.36, 8.5.x before 8.5.3, and 9.x before 9.0.0.M7 and other products, allows remote attackers to cause a denial of service (CPU consumption) via a long boundary string.",2016-08-24,2016-11-28,7.8,10.0,6.9,NVD,,NEW,,,,"http://web.nvd.nist.gov/view/vuln/detail?vulnId=CVE-2016-3092",HIGH,"2017-05-26 01:30:59.716"
